{
  "$schema": "./schemas/account-resolution-manifest.schema.json",
  "schemaVersion": 1,
  "protocolRevision": "devnet-2026-10-26-bc09061",
  "programs": [
    {
      "name": "dusk",
      "programId": "JA8Zxxm4t4zopBL8e3dQQXWfQ3a5pBUPY9Sp9RnybV2X",
      "idlSha256": "574f9a347a2ecf2f85fa6d9f981fb474b1300f2e9cca5ae0ca0158da113019eb"
    },
    {
      "name": "leverage_delegate",
      "programId": "AXNfmZt5e1UM4daeTzW3H7zNo4boobBcnFm8RzJYxvAv",
      "idlSha256": "59acc8a10b41c235156e593017b1e88dd6657fd192df4a1f1c0cc4275a1dd658"
    }
  ],
  "staticAccounts": [
    {
      "instructionKey": "dusk:settle_flash_liquidation",
      "accountName": "token_program",
      "address": "TokenkegQfeZyiNwAJbNbGKPFXCWuBvf9Ss623VQ5DA",
      "source": "idl_fixed_address"
    },
    {
      "instructionKey": "dusk:settle_flash_liquidation",
      "accountName": "token_2022_program",
      "address": "TokenzQdBNbLqP5VEhdkAS6EPFLC1PHnBqCXEpPxuEb",
      "source": "idl_fixed_address"
    },
    {
      "instructionKey": "dusk:settle_flash_liquidation",
      "accountName": "instructions",
      "address": "Sysvar1nstructions1111111111111111111111111",
      "source": "idl_fixed_address"
    },
    {
      "instructionKey": "dusk:settle_flash_liquidation",
      "accountName": "program",
      "address": "JA8Zxxm4t4zopBL8e3dQQXWfQ3a5pBUPY9Sp9RnybV2X",
      "source": "instruction_program"
    },
    {
      "instructionKey": "dusk:observe_liquidation",
      "accountName": "program",
      "address": "JA8Zxxm4t4zopBL8e3dQQXWfQ3a5pBUPY9Sp9RnybV2X",
      "source": "instruction_program"
    },
    {
      "instructionKey": "dusk:begin_flash_liquidation",
      "accountName": "token_program",
      "address": "TokenkegQfeZyiNwAJbNbGKPFXCWuBvf9Ss623VQ5DA",
      "source": "idl_fixed_address"
    },
    {
      "instructionKey": "dusk:begin_flash_liquidation",
      "accountName": "token_2022_program",
      "address": "TokenzQdBNbLqP5VEhdkAS6EPFLC1PHnBqCXEpPxuEb",
      "source": "idl_fixed_address"
    },
    {
      "instructionKey": "dusk:begin_flash_liquidation",
      "accountName": "instructions",
      "address": "Sysvar1nstructions1111111111111111111111111",
      "source": "idl_fixed_address"
    },
    {
      "instructionKey": "dusk:begin_flash_liquidation",
      "accountName": "system_program",
      "address": "11111111111111111111111111111111",
      "source": "idl_fixed_address"
    },
    {
      "instructionKey": "dusk:begin_flash_liquidation",
      "accountName": "program",
      "address": "JA8Zxxm4t4zopBL8e3dQQXWfQ3a5pBUPY9Sp9RnybV2X",
      "source": "instruction_program"
    },
    {
      "instructionKey": "dusk:emergency_liquidation",
      "accountName": "token_program",
      "address": "TokenkegQfeZyiNwAJbNbGKPFXCWuBvf9Ss623VQ5DA",
      "source": "idl_fixed_address"
    },
    {
      "instructionKey": "dusk:emergency_liquidation",
      "accountName": "token_2022_program",
      "address": "TokenzQdBNbLqP5VEhdkAS6EPFLC1PHnBqCXEpPxuEb",
      "source": "idl_fixed_address"
    },
    {
      "instructionKey": "dusk:emergency_liquidation",
      "accountName": "instructions",
      "address": "Sysvar1nstructions1111111111111111111111111",
      "source": "idl_fixed_address"
    },
    {
      "instructionKey": "dusk:emergency_liquidation",
      "accountName": "program",
      "address": "JA8Zxxm4t4zopBL8e3dQQXWfQ3a5pBUPY9Sp9RnybV2X",
      "source": "instruction_program"
    },
    {
      "instructionKey": "dusk:begin_hlp_flash",
      "accountName": "token_program",
      "address": "TokenkegQfeZyiNwAJbNbGKPFXCWuBvf9Ss623VQ5DA",
      "source": "idl_fixed_address"
    },
    {
      "instructionKey": "dusk:begin_hlp_flash",
      "accountName": "token_2022_program",
      "address": "TokenzQdBNbLqP5VEhdkAS6EPFLC1PHnBqCXEpPxuEb",
      "source": "idl_fixed_address"
    },
    {
      "instructionKey": "dusk:begin_hlp_flash",
      "accountName": "instructions",
      "address": "Sysvar1nstructions1111111111111111111111111",
      "source": "idl_fixed_address"
    },
    {
      "instructionKey": "dusk:begin_hlp_flash",
      "accountName": "system_program",
      "address": "11111111111111111111111111111111",
      "source": "idl_fixed_address"
    },
    {
      "instructionKey": "dusk:begin_hlp_flash",
      "accountName": "program",
      "address": "JA8Zxxm4t4zopBL8e3dQQXWfQ3a5pBUPY9Sp9RnybV2X",
      "source": "instruction_program"
    },
    {
      "instructionKey": "dusk:settle_hlp_flash",
      "accountName": "token_program",
      "address": "TokenkegQfeZyiNwAJbNbGKPFXCWuBvf9Ss623VQ5DA",
      "source": "idl_fixed_address"
    },
    {
      "instructionKey": "dusk:settle_hlp_flash",
      "accountName": "token_2022_program",
      "address": "TokenzQdBNbLqP5VEhdkAS6EPFLC1PHnBqCXEpPxuEb",
      "source": "idl_fixed_address"
    },
    {
      "instructionKey": "dusk:settle_hlp_flash",
      "accountName": "instructions",
      "address": "Sysvar1nstructions1111111111111111111111111",
      "source": "idl_fixed_address"
    },
    {
      "instructionKey": "dusk:settle_hlp_flash",
      "accountName": "program",
      "address": "JA8Zxxm4t4zopBL8e3dQQXWfQ3a5pBUPY9Sp9RnybV2X",
      "source": "instruction_program"
    },
    {
      "instructionKey": "dusk:close_insolvent_hlp",
      "accountName": "token_program",
      "address": "TokenkegQfeZyiNwAJbNbGKPFXCWuBvf9Ss623VQ5DA",
      "source": "idl_fixed_address"
    },
    {
      "instructionKey": "dusk:close_insolvent_hlp",
      "accountName": "token_2022_program",
      "address": "TokenzQdBNbLqP5VEhdkAS6EPFLC1PHnBqCXEpPxuEb",
      "source": "idl_fixed_address"
    },
    {
      "instructionKey": "dusk:close_insolvent_hlp",
      "accountName": "program",
      "address": "JA8Zxxm4t4zopBL8e3dQQXWfQ3a5pBUPY9Sp9RnybV2X",
      "source": "instruction_program"
    },
    {
      "instructionKey": "dusk:delegated_close_leverage",
      "accountName": "delegated_program",
      "address": "AXNfmZt5e1UM4daeTzW3H7zNo4boobBcnFm8RzJYxvAv",
      "source": "action_cpi_program"
    },
    {
      "instructionKey": "dusk:delegated_close_leverage",
      "accountName": "instructions_sysvar",
      "address": "Sysvar1nstructions1111111111111111111111111",
      "source": "idl_fixed_address"
    },
    {
      "instructionKey": "dusk:delegated_close_leverage",
      "accountName": "token_program",
      "address": "TokenkegQfeZyiNwAJbNbGKPFXCWuBvf9Ss623VQ5DA",
      "source": "idl_fixed_address"
    },
    {
      "instructionKey": "dusk:delegated_close_leverage",
      "accountName": "token_2022_program",
      "address": "TokenzQdBNbLqP5VEhdkAS6EPFLC1PHnBqCXEpPxuEb",
      "source": "idl_fixed_address"
    },
    {
      "instructionKey": "dusk:delegated_close_leverage",
      "accountName": "program",
      "address": "JA8Zxxm4t4zopBL8e3dQQXWfQ3a5pBUPY9Sp9RnybV2X",
      "source": "instruction_program"
    },
    {
      "instructionKey": "dusk:settle_protocol_auction",
      "accountName": "token_program",
      "address": "TokenkegQfeZyiNwAJbNbGKPFXCWuBvf9Ss623VQ5DA",
      "source": "idl_fixed_address"
    },
    {
      "instructionKey": "dusk:settle_protocol_auction",
      "accountName": "token_2022_program",
      "address": "TokenzQdBNbLqP5VEhdkAS6EPFLC1PHnBqCXEpPxuEb",
      "source": "idl_fixed_address"
    },
    {
      "instructionKey": "dusk:settle_protocol_auction",
      "accountName": "program",
      "address": "JA8Zxxm4t4zopBL8e3dQQXWfQ3a5pBUPY9Sp9RnybV2X",
      "source": "instruction_program"
    },
    {
      "instructionKey": "dusk:queue_parameter_proposal",
      "accountName": "program",
      "address": "JA8Zxxm4t4zopBL8e3dQQXWfQ3a5pBUPY9Sp9RnybV2X",
      "source": "instruction_program"
    },
    {
      "instructionKey": "dusk:execute_parameter_proposal",
      "accountName": "program",
      "address": "JA8Zxxm4t4zopBL8e3dQQXWfQ3a5pBUPY9Sp9RnybV2X",
      "source": "instruction_program"
    }
  ],
  "pdaRecipes": [
    {
      "key": "dusk:market",
      "program": "dusk",
      "programId": "JA8Zxxm4t4zopBL8e3dQQXWfQ3a5pBUPY9Sp9RnybV2X",
      "usages": [
        {
          "instructionKey": "dusk:settle_flash_liquidation",
          "accountName": "market",
          "idlSeedPaths": [
            "const:6d61726b65745f7632",
            "account:market.base_side.asset_mint",
            "account:market.quote_side.asset_mint",
            "account:market.params_hash"
          ]
        },
        {
          "instructionKey": "dusk:preview_flash_liquidation",
          "accountName": "market",
          "idlSeedPaths": [
            "const:6d61726b65745f7632",
            "account:market.base_side.asset_mint",
            "account:market.quote_side.asset_mint",
            "account:market.params_hash"
          ]
        },
        {
          "instructionKey": "dusk:preview_emergency_liquidation",
          "accountName": "market",
          "idlSeedPaths": [
            "const:6d61726b65745f7632",
            "account:market.base_side.asset_mint",
            "account:market.quote_side.asset_mint",
            "account:market.params_hash"
          ]
        },
        {
          "instructionKey": "dusk:observe_liquidation",
          "accountName": "market",
          "idlSeedPaths": [
            "const:6d61726b65745f7632",
            "account:market.base_side.asset_mint",
            "account:market.quote_side.asset_mint",
            "account:market.params_hash"
          ]
        },
        {
          "instructionKey": "dusk:begin_flash_liquidation",
          "accountName": "market",
          "idlSeedPaths": [
            "const:6d61726b65745f7632",
            "account:market.base_side.asset_mint",
            "account:market.quote_side.asset_mint",
            "account:market.params_hash"
          ]
        },
        {
          "instructionKey": "dusk:emergency_liquidation",
          "accountName": "market",
          "idlSeedPaths": [
            "const:6d61726b65745f7632",